番号,表現,例文（英語）,例文（和訳）,文法ポイント,使用場面,カジュアル版,フォーマル版,よくある間違い,備考
1,"To put it simply...","How does blockchain work? / To put it simply, it's a distributed ledger that records transactions securely.","ブロックチェーンはどう動きますか？/ 簡単に言うと、取引を安全に記録する分散型台帳です。","to不定詞で目的。put it simply慣用句。","技術説明、概念の簡略化、初心者への説明","Basically...","In simplified terms...","To put simply... (itの欠落)","simplyを明快に発音して簡潔さを強調"
2,"The way it works is...","How does the approval system function? / The way it works is that all requests go through three levels of review.","承認システムはどう機能しますか？/ 仕組みとしては、すべてのリクエストが3段階のレビューを通ります。","the wayで方法。is that節で説明。","システム説明、プロセス解説、機能の説明","How it works is...","The mechanism operates as follows...","The way how it works... (howは不要)","worksを機械的な動作をイメージして発音"
3,"In essence...","What's the core problem? / In essence, we're dealing with a scalability issue.","中心的な問題は何ですか？/ 本質的には、スケーラビリティの問題に対処しています。","in essence慣用句。文頭で使用。","問題の本質、概念の核心、要約","Basically...","Fundamentally...","In the essence... (冠詞は不要)","essenceを本質を表すように深く発音"
4,"Let me break this down...","That seems complicated. / Let me break this down into three main components.","それは複雑そうです。/ これを3つの主要コンポーネントに分解して説明させてください。","break down句動詞。let使役動詞。","複雑な説明、段階的解説、詳細な分析","Here's the breakdown...","Allow me to deconstruct this...","Let me break down this... (語順も可だが不自然)","breakを分解のジェスチャーと共に"
5,"Think of it as...","What's a API? / Think of it as a waiter taking your order to the kitchen.","APIとは何ですか？/ 注文を厨房に運ぶウェイターのようなものと考えてください。","think of A as B構文。比喩表現。","技術概念の説明、抽象的な内容、初心者への解説","It's like...","One might conceptualize it as...","Think it as... (ofの欠落)","asの後で少し間を置いて比喩を強調"
6,"What I mean by that is...","We need to be more agile. / What I mean by that is we should iterate faster and adapt quickly.","もっとアジャイルになる必要があります。/ つまり私が言いたいのは、より速く反復し、素早く適応すべきということです。","what節が主語。mean by構文。","意図の明確化、誤解の防止、詳細な説明","I mean...","To clarify my point...","What I mean is that... (by thatの欠落)","meanを強調して意図を明確に"
7,"It's characterized by...","What defines this approach? / It's characterized by rapid iteration and continuous feedback.","このアプローチを定義するものは？/ 迅速な反復と継続的なフィードバックという特徴があります。","受動態。前置詞by。","製品の特徴、手法の説明、スタイルの描写","Its main features are...","It is distinguished by...","It's characterized with... (前置詞の誤り)","characterizedを特徴を列挙するように発音"
8,"The gist of it is...","Can you summarize the report? / The gist of it is that we need to pivot our strategy.","レポートを要約できますか？/ 要点は、戦略を転換する必要があるということです。","the gist慣用句。that節。","報告の要約、長い説明の要点、結論の提示","Bottom line...","The essential point is...","The gist is... (of itがあった方が自然)","gistを要点として強調"
9,"It goes without saying that...","What about security? / It goes without saying that all data will be encrypted.","セキュリティはどうですか？/ 言うまでもなく、すべてのデータは暗号化されます。","慣用句。that節が続く。","前提の確認、重要事項の強調、当然の事実","Obviously...","Needless to say...","It goes without say... (動名詞の欠落)","sayingを当然さを込めて発音"
10,"In a nutshell...","What's the plan? / In a nutshell, we're automating everything we can.","計画は何ですか？/ 一言で言えば、できる限りすべてを自動化します。","in a nutshell慣用句。冠詞a必要。","簡潔な要約、手短な説明、結論の提示","Long story short...","To summarize concisely...","In the nutshell... (冠詞の誤り)","nutshellを小ささをイメージして発音"
11,"For lack of a better term...","How would you describe it? / It's, for lack of a better term, a hybrid approach.","どう説明しますか？/ 適切な言葉がないので、ハイブリッドアプローチとでも言いましょうか。","for lack of慣用句。挿入句的使用。","新しい概念の説明、適切な専門用語がない時、比喩的表現","I guess you could say...","For want of a more precise term...","For a lack of... (冠詞の誤り)","lackを探すような調子で発音"
12,"The thing is...","Why can't we launch now? / The thing is, we haven't completed security testing.","なぜ今リリースできないのですか？/ 実は、セキュリティテストが完了していません。","The thing is慣用句。that省略可。","問題の説明、重要な事実、理由の提示","Here's the thing...","The issue is...","A thing is... (冠詞の誤り)","thingを重要性を込めて発音"
13,"To give you some context...","Why this sudden change? / To give you some context, we lost our main client last month.","なぜこの突然の変更ですか？/ 背景を説明しますと、先月主要クライアントを失いました。","to不定詞で目的。some context。","背景説明、状況の提供、理解の促進","Some background...","To provide contextual information...","To give you a context... (冠詞は不要かsome)","contextを背景を広げるように発音"
14,"What happens is...","How does the error occur? / What happens is the system runs out of memory during peak load.","エラーはどう発生しますか？/ 何が起こるかというと、ピーク負荷時にシステムがメモリ不足になります。","what節が主語。三単現happens。","エラーの説明、プロセスの描写、結果の説明","Basically...","The sequence of events is...","What happen is... (三単現のs欠落)","happensを出来事が起こるように発音"
15,"It's worth noting that...","Is the system ready? / Yes, but it's worth noting that we'll need extra monitoring initially.","システムは準備できていますか？/ はい、ただし最初は追加の監視が必要なことは注目すべきです。","worth + 動名詞。that節。","重要な追加情報、注意事項、補足説明","Also...","It should be noted that...","It's worth to note... (to不定詞の誤り)","notingを注意を引くように発音"
16,"Picture this...","How bad is the situation? / Picture this: half our servers down during Black Friday.","状況はどのくらい悪いですか？/ 想像してみてください：ブラックフライデーにサーバーの半分がダウン。","命令文。コロンで状況提示。","状況の描写、シナリオ説明、問題の可視化","Imagine...","Envision the following scenario...","Picture that this... (構文の誤り)","pictureを絵を描くように発音"
17,"By way of explanation...","Why the delay? / By way of explanation, our supplier faced unexpected shortages.","なぜ遅延したのですか？/ 説明として、サプライヤーが予期せぬ不足に直面しました。","by way of慣用句。文頭使用。","正式な説明、理由の提示、状況の解説","To explain...","As an explanatory note...","By the way of explanation... (冠詞は不要)","explanationを説明的なトーンで"
18,"Here's what's happening...","Why is everything slow? / Here's what's happening: we're experiencing a DDoS attack.","なぜすべてが遅いのですか？/ 現在起きているのは：DDoS攻撃を受けています。","Here's提示。現在進行形。","現状報告、問題の説明、リアルタイム更新","So basically...","The current situation is...","Here's what happening... (be動詞の欠落)","happeningを現在進行を示すように発音"
19,"The upside is...","The migration will take weeks. / True, but the upside is we'll have better performance and security.","移行には数週間かかります。/ 確かに、しかし良い面は、より良いパフォーマンスとセキュリティが得られることです。","the upside特定。that省略可。","メリットの説明、ポジティブな側面、バランスの取れた説明","On the plus side...","The advantage is...","An upside is... (冠詞の誤り)","upsideを上向きのトーンで発音"
20,"As far as... is concerned","What about compatibility? / As far as compatibility is concerned, we support all major browsers.","互換性はどうですか？/ 互換性に関して言えば、すべての主要ブラウザをサポートしています。","as far as慣用句。受動態。","特定トピックの説明、観点の明確化、範囲の限定","About...","With regard to...","As far as... concerns (be動詞の欠落)","concernedを関連性を示すように発音"
21,"That being said...","The solution works well. / That being said, we should still test edge cases.","ソリューションはうまく機能します。/ そうは言っても、エッジケースはテストすべきです。","独立分詞構文。文頭使用。","バランスの取れた説明、注意事項の追加、別視点の提供","Still...","Nevertheless...","That been said... (分詞の誤り)","saidを前言を受ける調子で発音"
22,"It turns out that...","What caused the bug? / It turns out that the API was returning cached data.","バグの原因は何でしたか？/ 判明したところでは、APIがキャッシュされたデータを返していました。","turn out慣用句。that節。","調査結果、意外な発見、問題の原因","Apparently...","Upon investigation...","It turns out to be that... (構文の混同)","turnsを発見の驚きを込めて発音"
23,"More specifically...","We need to improve performance. / More specifically, we need to optimize database queries.","パフォーマンスを改善する必要があります。/ より具体的には、データベースクエリを最適化する必要があります。","比較級。副詞specifically。","詳細化、具体例の提示、焦点の絞り込み","To be specific...","To be more precise...","More specific... (副詞形の誤り)","specificallyを明確に区切って発音"
24,"The idea behind this is...","Why this approach? / The idea behind this is to minimize dependencies.","なぜこのアプローチですか？/ この背後にある考えは、依存関係を最小限にすることです。","behind前置詞。to不定詞で目的。","設計思想、戦略の説明、コンセプト解説","The thinking is...","The underlying concept is...","The idea behind of this... (前置詞の重複)","ideaを概念的に発音"
25,"Case in point...","Is this really a problem? / Case in point: we had three outages last week alone.","これは本当に問題ですか？/ 良い例として：先週だけで3回の停止がありました。","case in point慣用句。コロンで例示。","具体例の提示、主張の裏付け、説得力の強化","For example...","A pertinent example would be...","A case in point... (冠詞は不要)","caseを証拠を提示するように発音"